{
  "version": "6.0-alpha.2",
  "graphId": "audit-assistant-h1-h2-complex",
  "title": "审核智能助手 2026 H1 复盘与 H2 规模化计划",
  "subtitle": "同题盲测：结果、趋势、架构、流程、决策、风险与 H2 计划",
  "sourceRef": "examples/complex-review/source.md",
  "nodes": [
    {
      "id": "t1",
      "kind": "thesis",
      "headline": "已进入可复用阶段，H2 主线必须从扩功能转向稳定、复用与治理",
      "detail": "H1 结果成立，但跨团队规模化仍受口径、权限和知识闭环制约。",
      "importance": "critical",
      "sourceQuote": "H1 的核心结论是：审核智能助手已经从单点工具进入可复用能力阶段，但距离跨团队规模化仍有治理缺口。核心目标完成率为 82%，累计节省人工分析时间 4200 小时，重点场景月活使用率达到 68%，折算释放约 0.7 FTE；同时，跨团队指标口径、权限边界和知识复用机制尚未完全统一，因此 H2 不能只追求新增功能数量，而应把稳定性、复用率和治理闭环作为主线。",
      "sourceUnitIds": [
        "U01",
        "U02"
      ]
    },
    {
      "id": "m1",
      "kind": "metric",
      "headline": "核心目标完成率",
      "detail": "H1 总体目标达成",
      "importance": "high",
      "sourceQuote": "核心目标完成率为 82%",
      "sourceUnitIds": [
        "U02"
      ],
      "measure": {
        "display": "82%",
        "value": 82,
        "unit": "%",
        "direction": "target"
      },
      "status": "good"
    },
    {
      "id": "m2",
      "kind": "metric",
      "headline": "累计节省分析时间",
      "detail": "释放约 0.7 FTE",
      "importance": "high",
      "sourceQuote": "累计节省人工分析时间 4200 小时",
      "sourceUnitIds": [
        "U02"
      ],
      "measure": {
        "display": "4200h",
        "value": 4200,
        "unit": "小时",
        "direction": "up"
      },
      "status": "good"
    },
    {
      "id": "m3",
      "kind": "metric",
      "headline": "重点场景月活",
      "detail": "规模化使用基础",
      "importance": "high",
      "sourceQuote": "重点场景月活使用率达到 68%",
      "sourceUnitIds": [
        "U02"
      ],
      "measure": {
        "display": "68%",
        "value": 68,
        "unit": "%",
        "direction": "up"
      },
      "status": "good"
    },
    {
      "id": "tr1",
      "kind": "trend",
      "headline": "周活连续 6 周增长",
      "detail": "41% → 46% → 49% → 55% → 61% → 68%",
      "importance": "high",
      "sourceQuote": "连续 6 周的周活使用率分别为 41%、46%、49%、55%、61% 和 68%，呈稳定上升；同一周期内，错误结论外发率从 7.2% 降至 2.8%，平均人工复核时长从 38 分钟降至 14 分钟。增长主要来自量级异常分析和延时诊断两个高频入口，而不是一次性活动拉动；这说明产品价值已经从“偶尔使用”转向“日常运营依赖”。",
      "sourceUnitIds": [
        "U03",
        "U04"
      ]
    },
    {
      "id": "tr2",
      "kind": "result",
      "headline": "错误结论外发率下降",
      "detail": "7.2% → 2.8%",
      "importance": "high",
      "sourceQuote": "错误结论外发率从 7.2% 降至 2.8%",
      "sourceUnitIds": [
        "U04"
      ],
      "status": "good",
      "measure": {
        "display": "7.2% → 2.8%",
        "value": 2.8,
        "unit": "%",
        "direction": "down"
      }
    },
    {
      "id": "tr3",
      "kind": "result",
      "headline": "人工复核显著提速",
      "detail": "38 分钟 → 14 分钟",
      "importance": "high",
      "sourceQuote": "平均人工复核时长从 38 分钟降至 14 分钟",
      "sourceUnitIds": [
        "U04"
      ],
      "status": "good",
      "measure": {
        "display": "38 → 14 min",
        "value": 14,
        "unit": "分钟",
        "direction": "down"
      }
    },
    {
      "id": "cov1",
      "kind": "result",
      "headline": "生产覆盖",
      "detail": "5 个 Skill / 12 个场景 / 3 个部门",
      "importance": "high",
      "sourceQuote": "当前已经上线 5 个生产 Skill，覆盖量级异常、延时诊断、RR 调整、任务池查询和知识问答 5 类能力，共承接 12 个业务场景，服务 3 个部门。试点团队的周留存为 73%，用户满意度为 4.4/5；但不同部门对“异常”“有效样本”和“SLA 达标”的定义仍不一致，导致同一结果在跨团队汇报时需要二次解释。",
      "sourceUnitIds": [
        "U05",
        "U06"
      ]
    },
    {
      "id": "cov2",
      "kind": "metric",
      "headline": "试点周留存",
      "detail": "高频用户持续使用",
      "importance": "high",
      "sourceQuote": "试点团队的周留存为 73%",
      "sourceUnitIds": [
        "U06"
      ],
      "measure": {
        "display": "73%",
        "value": 73,
        "unit": "%",
        "direction": "up"
      },
      "status": "good"
    },
    {
      "id": "cov3",
      "kind": "metric",
      "headline": "用户满意度",
      "detail": "试点反馈良好",
      "importance": "medium",
      "sourceQuote": "用户满意度为 4.4/5",
      "sourceUnitIds": [
        "U06"
      ],
      "measure": {
        "display": "4.4/5",
        "value": 4.4,
        "unit": "/5",
        "direction": "target"
      },
      "status": "good"
    },
    {
      "id": "c1",
      "kind": "capability",
      "headline": "入口层",
      "detail": "群聊关键词、队列 ID、文档链接",
      "importance": "medium",
      "sourceQuote": "现有系统由 5 层组成：入口层负责群聊关键词、队列 ID 和文档链接接入；路由层识别意图并选择 Skill；执行层完成数据查询、异常识别和结果解释；知识层沉淀口径、案例、错误与决策；治理层负责权限、审计、评测和版本回滚。当前执行层稳定性最高，知识层与治理层成熟度最低，尤其是知识失效后的更新责任和高风险动作的人工复核边界仍未固化。",
      "sourceUnitIds": [
        "U07",
        "U08"
      ]
    },
    {
      "id": "c2",
      "kind": "capability",
      "headline": "路由层",
      "detail": "识别意图并选择 Skill",
      "importance": "medium",
      "sourceQuote": "路由层识别意图并选择 Skill",
      "sourceUnitIds": [
        "U08"
      ]
    },
    {
      "id": "c3",
      "kind": "capability",
      "headline": "执行层",
      "detail": "数据查询、异常识别、结果解释；当前最稳定",
      "importance": "high",
      "sourceQuote": "执行层完成数据查询、异常识别和结果解释",
      "sourceUnitIds": [
        "U08"
      ],
      "status": "good"
    },
    {
      "id": "c4",
      "kind": "capability",
      "headline": "知识层",
      "detail": "沉淀口径、案例、错误与决策；成熟度偏低",
      "importance": "high",
      "sourceQuote": "知识层沉淀口径、案例、错误与决策",
      "sourceUnitIds": [
        "U08"
      ],
      "status": "warning"
    },
    {
      "id": "c5",
      "kind": "capability",
      "headline": "治理层",
      "detail": "权限、审计、评测、回滚；边界尚未固化",
      "importance": "high",
      "sourceQuote": "治理层负责权限、审计、评测和版本回滚",
      "sourceUnitIds": [
        "U08"
      ],
      "status": "warning"
    },
    {
      "id": "s1",
      "kind": "input",
      "headline": "用户触发",
      "detail": "关键词、队列或文档入口",
      "importance": "medium",
      "sourceQuote": "一次完整任务依次经过 6 个阶段：1）用户触发；2）检索定位；3）数据校验；4）智能分析；5）人工复核；6）结果沉淀。当前 p95 响应时间小于 28 秒，93% 的任务可在一次对话内完成，7% 需要补充队列 ID、时间范围或权限。最容易阻塞的是数据校验阶段，主要原因是字段口径不一致和历史数据缺失。",
      "sourceUnitIds": [
        "U09",
        "U10"
      ],
      "order": 1
    },
    {
      "id": "s2",
      "kind": "stage",
      "headline": "检索定位",
      "detail": "找到任务与数据范围",
      "importance": "medium",
      "sourceQuote": "2）检索定位",
      "sourceUnitIds": [
        "U10"
      ],
      "order": 2
    },
    {
      "id": "s3",
      "kind": "stage",
      "headline": "数据校验",
      "detail": "阻塞最多：口径不一致、历史数据缺失",
      "importance": "high",
      "sourceQuote": "3）数据校验",
      "sourceUnitIds": [
        "U10"
      ],
      "order": 3,
      "status": "warning"
    },
    {
      "id": "s4",
      "kind": "stage",
      "headline": "智能分析",
      "detail": "生成异常判断与解释",
      "importance": "medium",
      "sourceQuote": "4）智能分析",
      "sourceUnitIds": [
        "U10"
      ],
      "order": 4
    },
    {
      "id": "s5",
      "kind": "stage",
      "headline": "人工复核",
      "detail": "控制高风险结论",
      "importance": "medium",
      "sourceQuote": "5）人工复核",
      "sourceUnitIds": [
        "U10"
      ],
      "order": 5
    },
    {
      "id": "s6",
      "kind": "output",
      "headline": "结果沉淀",
      "detail": "结论进入知识与复盘",
      "importance": "medium",
      "sourceQuote": "6）结果沉淀",
      "sourceUnitIds": [
        "U10"
      ],
      "order": 6
    },
    {
      "id": "m4",
      "kind": "metric",
      "headline": "p95 响应",
      "detail": "93% 一次对话完成，7% 需补信息",
      "importance": "high",
      "sourceQuote": "当前 p95 响应时间小于 28 秒",
      "sourceUnitIds": [
        "U10"
      ],
      "measure": {
        "display": "<28s",
        "value": 28,
        "unit": "秒",
        "direction": "down"
      },
      "status": "good"
    },
    {
      "id": "mat1",
      "kind": "evidence",
      "headline": "L4 稳定能力",
      "detail": "量级异常分析、任务池查询",
      "importance": "high",
      "sourceQuote": "五类核心能力的成熟度不同：量级异常分析为 L4，已经支持分钟级定位和主因归纳；延时诊断为 L3，可定位异常日期与环节，但根因解释仍依赖人工；RR 调整为 L3，能够识别空间和给出建议；任务池查询为 L4，链路稳定且可追溯；知识问答为 L2，能回答常见口径，但对跨文档冲突和知识时效的处理仍不稳定。",
      "sourceUnitIds": [
        "U11",
        "U12"
      ]
    },
    {
      "id": "mat2",
      "kind": "evidence",
      "headline": "L3 成长能力",
      "detail": "延时诊断、RR 调整",
      "importance": "medium",
      "sourceQuote": "延时诊断为 L3",
      "sourceUnitIds": [
        "U12"
      ]
    },
    {
      "id": "mat3",
      "kind": "constraint",
      "headline": "L2 知识问答",
      "detail": "跨文档冲突和时效处理仍不稳定",
      "importance": "high",
      "sourceQuote": "知识问答为 L2",
      "sourceUnitIds": [
        "U12"
      ],
      "status": "warning"
    },
    {
      "id": "ev1",
      "kind": "evidence",
      "headline": "复盘样本充分",
      "detail": "12000 条任务 / 86 次访谈 / 24 份周报 / 37 个失败案例",
      "importance": "high",
      "sourceQuote": "本次复盘使用了 12000 条历史任务、86 次用户访谈、24 份周报和 37 个失败案例。数据显示，高频场景贡献了 79% 的使用量，配置不完整导致了 44% 的失败，知识过期导致了 21% 的错误解释，权限不足导致了 18% 的中断，其余 17% 来自模型误判、网络波动和人工操作。证据支持“先治理再扩张”，而不是继续平均投入所有场景。",
      "sourceUnitIds": [
        "U13",
        "U14"
      ]
    },
    {
      "id": "ev2",
      "kind": "evidence",
      "headline": "使用高度集中",
      "detail": "高频场景贡献 79% 使用量",
      "importance": "high",
      "sourceQuote": "高频场景贡献了 79% 的使用量",
      "sourceUnitIds": [
        "U14"
      ]
    },
    {
      "id": "ev3",
      "kind": "evidence",
      "headline": "失败构成",
      "detail": "配置 44% / 知识过期 21% / 权限 18% / 其他 17%",
      "importance": "high",
      "sourceQuote": "配置不完整导致了 44% 的失败，知识过期导致了 21% 的错误解释，权限不足导致了 18% 的中断，其余 17%",
      "sourceUnitIds": [
        "U14"
      ]
    },
    {
      "id": "rc1",
      "kind": "constraint",
      "headline": "数据口径分散",
      "detail": "52% 的关键指标没有统一字典",
      "importance": "high",
      "sourceQuote": "当前问题可以归纳为 4 个根因：第一，数据口径分散，约 52% 的关键指标没有统一字典；第二，责任边界不清，知识更新、异常升级和评测维护缺少明确 owner；第三，复盘机制偏事后，问题通常在周报阶段才被发现；第四，复用资产碎片化，Skill、Wiki、SOP 和案例库之间没有稳定引用关系。这 4 个根因互相强化，单独增加模型能力无法解决。",
      "sourceUnitIds": [
        "U15",
        "U16"
      ],
      "status": "warning"
    },
    {
      "id": "rc2",
      "kind": "constraint",
      "headline": "责任边界不清",
      "detail": "知识更新、异常升级、评测维护缺少 owner",